{
  "$comment": "GENERATED by bun nv render — do not edit",
  "$schema": "https://json-schema.org/draft/2020-12/schema",
  "title": "reference_chapter",
  "type": "object",
  "properties": {
    "slug": {
      "type": "string",
      "pattern": "^[a-z0-9][a-z0-9-]*$"
    },
    "title": {
      "type": "string"
    },
    "summary": {
      "type": "string"
    },
    "keywords": {
      "type": "array",
      "items": {
        "type": "string"
      }
    }
  },
  "required": [
    "summary",
    "keywords"
  ],
  "additionalProperties": false
}
