{
  "slug": "testing",
  "title": "Testing",
  "summary": "`#[Test]` methods, `nvs test`, a directory of test files as one program, fixtures, data rows, the assertion roster, fixed clocks and seeds, and the report formats",
  "keywords": [
    "test",
    "#[Test]",
    "nvs test",
    "test directory",
    "test suite",
    "bootstrap",
    "PHPUnit",
    "TestCase",
    "assertEquals",
    "assertSame",
    "assertTrue",
    "assertNull",
    "assertCount",
    "expectException",
    "assertThrows",
    "dataProvider",
    "TestWith",
    "Fixture",
    "setUp",
    "skip",
    "markTestSkipped",
    "retries",
    "flaky",
    "Core\\Test",
    "Core\\Test\\Failure",
    "--format json",
    "junit",
    "fixed clock",
    "seed",
    ".nvst"
  ]
}
